{
  "ontologyVersion": "personal-care.v1",
  "verticalCode": "personalCareIndividualAppointment",
  "effectiveFrom": "2026-08-13",
  "locales": ["es", "en"],
  "families": [
    {
      "code": "ambience",
      "name": { "es": "Ambiente", "en": "Ambience" },
      "definition": {
        "es": "Percepción agregada y rasgos observables del ambiente durante la cita.",
        "en": "Aggregated perception and observable ambience traits during an appointment."
      }
    },
    {
      "code": "space",
      "name": { "es": "Espacio", "en": "Space" },
      "definition": {
        "es": "Configuración física verificable del establecimiento y sus zonas de atención.",
        "en": "Verifiable physical configuration of the venue and its service areas."
      }
    },
    {
      "code": "experience",
      "name": { "es": "Experiencia", "en": "Experience" },
      "definition": {
        "es": "Cualidades del recorrido de servicio observadas o agregadas con muestra suficiente.",
        "en": "Service journey qualities observed or aggregated with sufficient evidence."
      }
    },
    {
      "code": "offer",
      "name": { "es": "Oferta", "en": "Offer" },
      "definition": {
        "es": "Familias de servicios estructurados que pueden reservarse en el piloto.",
        "en": "Structured service families that can be booked in the pilot."
      }
    },
    {
      "code": "operation",
      "name": { "es": "Operación", "en": "Operation" },
      "definition": {
        "es": "Condiciones transaccionales, temporales y de disponibilidad derivadas del sistema.",
        "en": "Transactional, temporal and availability conditions derived from the system."
      }
    },
    {
      "code": "accessibility",
      "name": { "es": "Accesibilidad", "en": "Accessibility" },
      "definition": {
        "es": "Adaptaciones declaradas o verificadas sin inferir discapacidad de una persona.",
        "en": "Declared or verified accommodations without inferring a person's disability."
      }
    }
  ],
  "sources": [
    {
      "code": "venueDeclaration",
      "name": { "es": "Declaración del local", "en": "Venue declaration" },
      "reliabilityClass": "declared"
    },
    {
      "code": "structuredCatalog",
      "name": { "es": "Catálogo estructurado", "en": "Structured catalog" },
      "reliabilityClass": "verified"
    },
    {
      "code": "operational",
      "name": { "es": "Datos operativos", "en": "Operational data" },
      "reliabilityClass": "transactional"
    },
    {
      "code": "customerAggregate",
      "name": { "es": "Agregado de clientes", "en": "Customer aggregate" },
      "reliabilityClass": "aggregated"
    },
    {
      "code": "verifiedAudit",
      "name": { "es": "Auditoría verificada", "en": "Verified audit" },
      "reliabilityClass": "verified"
    },
    {
      "code": "imageAuxiliary",
      "name": { "es": "Imagen auxiliar", "en": "Auxiliary image" },
      "reliabilityClass": "auxiliary"
    }
  ],
  "attributes": [
    {
      "code": "calmAtmosphere",
      "family": "ambience",
      "parentCode": null,
      "name": { "es": "Ambiente tranquilo", "en": "Calm atmosphere" },
      "definition": {
        "es": "Percepción agregada de calma durante el servicio, sin inferir rasgos psicológicos.",
        "en": "Aggregated perception of calm during service without psychological inference."
      },
      "type": "subjectiveAggregate",
      "allowedSources": ["customerAggregate"],
      "validity": { "mode": "ttl", "ttlDays": 90 },
      "allowedUses": ["profile", "ranking", "explanation"],
      "minimumEvidence": 10,
      "status": "published"
    },
    {
      "code": "livelyAtmosphere",
      "family": "ambience",
      "parentCode": null,
      "name": { "es": "Ambiente animado", "en": "Lively atmosphere" },
      "definition": {
        "es": "Percepción agregada de actividad ambiental durante la cita.",
        "en": "Aggregated perception of environmental activity during the appointment."
      },
      "type": "subjectiveAggregate",
      "allowedSources": ["customerAggregate"],
      "validity": { "mode": "ttl", "ttlDays": 90 },
      "allowedUses": ["profile", "ranking", "explanation"],
      "minimumEvidence": 10,
      "status": "published"
    },
    {
      "code": "modernStyle",
      "family": "ambience",
      "parentCode": null,
      "name": { "es": "Estilo moderno", "en": "Modern style" },
      "definition": {
        "es": "Estética visual moderna declarada y apoyada de forma auxiliar por imágenes.",
        "en": "Declared modern visual style with auxiliary image support."
      },
      "type": "subjectiveAggregate",
      "allowedSources": ["venueDeclaration", "customerAggregate", "imageAuxiliary"],
      "validity": { "mode": "ttl", "ttlDays": 365 },
      "allowedUses": ["profile", "filtering", "ranking", "explanation"],
      "minimumEvidence": 5,
      "status": "published"
    },
    {
      "code": "classicStyle",
      "family": "ambience",
      "parentCode": null,
      "name": { "es": "Estilo clásico", "en": "Classic style" },
      "definition": {
        "es": "Estética visual clásica declarada y apoyada de forma auxiliar por imágenes.",
        "en": "Declared classic visual style with auxiliary image support."
      },
      "type": "subjectiveAggregate",
      "allowedSources": ["venueDeclaration", "customerAggregate", "imageAuxiliary"],
      "validity": { "mode": "ttl", "ttlDays": 365 },
      "allowedUses": ["profile", "filtering", "ranking", "explanation"],
      "minimumEvidence": 5,
      "status": "published"
    },
    {
      "code": "naturalLight",
      "family": "ambience",
      "parentCode": null,
      "name": { "es": "Luz natural visible", "en": "Visible natural light" },
      "definition": {
        "es": "Presencia verificable de luz natural en las zonas mostradas al público.",
        "en": "Verifiable natural light in areas shown to the public."
      },
      "type": "stable",
      "allowedSources": ["venueDeclaration", "verifiedAudit", "imageAuxiliary"],
      "validity": { "mode": "untilRetired", "ttlDays": null },
      "allowedUses": ["profile", "filtering", "ranking", "explanation"],
      "minimumEvidence": 1,
      "status": "published"
    },
    {
      "code": "lowNoiseAppointments",
      "family": "ambience",
      "parentCode": null,
      "name": { "es": "Citas de baja sonoridad", "en": "Low-noise appointments" },
      "definition": {
        "es": "Franjas declaradas y operadas con medidas objetivas para reducir ruido ambiental.",
        "en": "Declared and operated slots with objective measures to reduce ambient noise."
      },
      "type": "dynamic",
      "allowedSources": ["venueDeclaration", "operational"],
      "validity": { "mode": "ttl", "ttlDays": 30 },
      "allowedUses": ["profile", "filtering", "ranking", "explanation"],
      "minimumEvidence": 3,
      "status": "published"
    },
    {
      "code": "privateExperience",
      "family": "ambience",
      "parentCode": null,
      "name": { "es": "Experiencia privada", "en": "Private experience" },
      "definition": {
        "es": "Percepción agregada de privacidad basada en el servicio, no en la identidad del cliente.",
        "en": "Aggregated privacy perception based on service, not customer identity."
      },
      "type": "subjectiveAggregate",
      "allowedSources": ["customerAggregate"],
      "validity": { "mode": "ttl", "ttlDays": 90 },
      "allowedUses": ["profile", "ranking", "explanation"],
      "minimumEvidence": 10,
      "status": "published"
    },

    {
      "code": "privateCabin",
      "family": "space",
      "parentCode": null,
      "name": { "es": "Cabina privada", "en": "Private treatment room" },
      "definition": {
        "es": "Zona de tratamiento individual separada visualmente de otras estaciones.",
        "en": "Individual treatment area visually separated from other stations."
      },
      "type": "stable",
      "allowedSources": ["venueDeclaration", "verifiedAudit"],
      "validity": { "mode": "untilRetired", "ttlDays": null },
      "allowedUses": ["profile", "filtering", "ranking", "explanation"],
      "minimumEvidence": 1,
      "status": "published"
    },
    {
      "code": "dedicatedWaitingArea",
      "family": "space",
      "parentCode": null,
      "name": { "es": "Zona de espera dedicada", "en": "Dedicated waiting area" },
      "definition": {
        "es": "Espacio identificable destinado a esperar antes de la cita.",
        "en": "Identifiable area intended for waiting before the appointment."
      },
      "type": "stable",
      "allowedSources": ["venueDeclaration", "verifiedAudit", "imageAuxiliary"],
      "validity": { "mode": "untilRetired", "ttlDays": null },
      "allowedUses": ["profile", "filtering"],
      "minimumEvidence": 1,
      "status": "published"
    },
    {
      "code": "outdoorWaitingArea",
      "family": "space",
      "parentCode": null,
      "name": { "es": "Espera exterior", "en": "Outdoor waiting area" },
      "definition": {
        "es": "Zona exterior habilitada y declarada para la espera previa.",
        "en": "Declared outdoor area available for waiting before service."
      },
      "type": "stable",
      "allowedSources": ["venueDeclaration", "verifiedAudit"],
      "validity": { "mode": "untilRetired", "ttlDays": null },
      "allowedUses": ["profile", "filtering"],
      "minimumEvidence": 1,
      "status": "published"
    },
    {
      "code": "climateControlledSpace",
      "family": "space",
      "parentCode": null,
      "name": { "es": "Espacio climatizado", "en": "Climate-controlled space" },
      "definition": {
        "es": "Zona de atención con climatización operativa declarada o verificada.",
        "en": "Service area with declared or verified operational climate control."
      },
      "type": "stable",
      "allowedSources": ["venueDeclaration", "verifiedAudit"],